{
  "schemaVersion": 1,
  "review": [
    {
      "category": "motorcycle",
      "retained": [
        {
          "household": "997-3",
          "spaceId": "8"
        },
        {
          "household": "997-2",
          "spaceId": "63"
        },
        {
          "household": "999-4",
          "spaceId": "89"
        },
        {
          "household": "999-3",
          "spaceId": "127"
        }
      ],
      "released": [
        {
          "household": "999-2",
          "spaceId": "104",
          "reason": "unpaid_after_deadline"
        }
      ],
      "vacantSpaces": [
        "1",
        "2",
        "2-1",
        "3",
        "3-1",
        "4",
        "5",
        "6",
        "7",
        "9",
        "10",
        "11",
        "12",
        "13",
        "14",
        "14-1",
        "15",
        "16",
        "17",
        "18",
        "19",
        "20",
        "21",
        "22",
        "23",
        "24",
        "25",
        "26",
        "27",
        "28",
        "29",
        "30",
        "31",
        "32",
        "33",
        "34",
        "35",
        "36",
        "37",
        "38",
        "39",
        "40",
        "41",
        "42",
        "43",
        "44",
        "45",
        "46",
        "47",
        "48",
        "49",
        "50",
        "51",
        "52",
        "53",
        "54",
        "55",
        "56",
        "57",
        "58",
        "59",
        "60",
        "61",
        "62",
        "64",
        "65",
        "66",
        "67",
        "68",
        "69",
        "70",
        "71",
        "72",
        "73",
        "74",
        "75",
        "76",
        "77",
        "78",
        "79",
        "80",
        "81",
        "82",
        "83",
        "84",
        "85",
        "86",
        "87",
        "88",
        "90",
        "91",
        "92",
        "93",
        "94",
        "95",
        "96",
        "97",
        "98",
        "99",
        "100",
        "101",
        "102",
        "103",
        "105",
        "106",
        "107",
        "108",
        "109",
        "110",
        "111",
        "112",
        "113",
        "114",
        "115",
        "116",
        "117",
        "118",
        "119",
        "120",
        "121",
        "122",
        "123",
        "124",
        "125",
        "126",
        "128",
        "129",
        "130",
        "131",
        "132",
        "133",
        "134",
        "135",
        "136",
        "137",
        "138",
        "139",
        "140",
        "141",
        "142",
        "143",
        "144",
        "145",
        "146",
        "147",
        "148",
        "149",
        "150"
      ]
    },
    {
      "category": "bicycle_large",
      "retained": [
        {
          "household": "999-2",
          "spaceId": "大33"
        }
      ],
      "released": [
        {
          "household": "997-2",
          "spaceId": "大26",
          "reason": "unpaid_after_deadline"
        }
      ],
      "vacantSpaces": [
        "大1",
        "大2",
        "大3",
        "大4",
        "大5",
        "大6",
        "大7",
        "大8",
        "大9",
        "大10",
        "大11",
        "大12",
        "大13",
        "大14",
        "大15",
        "大16",
        "大17",
        "大18",
        "大19",
        "大20",
        "大21",
        "大22",
        "大23",
        "大24",
        "大25",
        "大27",
        "大28",
        "大29",
        "大30",
        "大31",
        "大32",
        "大34",
        "大35",
        "大36",
        "大37",
        "大38"
      ]
    },
    {
      "category": "bicycle_small",
      "retained": [],
      "released": [],
      "vacantSpaces": [
        "小39",
        "小40",
        "小41",
        "小42",
        "小43",
        "小44",
        "小45",
        "小46",
        "小47",
        "小48",
        "小49",
        "小50",
        "小51",
        "小52",
        "小53",
        "小54",
        "小55",
        "小56",
        "小57"
      ]
    }
  ],
  "pools": [
    {
      "id": "motorcycle",
      "households": [
        "997-2",
        "997-3",
        "999-2",
        "999-4"
      ],
      "candidates": [
        {
          "type": "space",
          "spaceId": "1"
        },
        {
          "type": "space",
          "spaceId": "2"
        },
        {
          "type": "space",
          "spaceId": "2-1"
        },
        {
          "type": "space",
          "spaceId": "3"
        },
        {
          "type": "space",
          "spaceId": "3-1"
        },
        {
          "type": "space",
          "spaceId": "4"
        },
        {
          "type": "space",
          "spaceId": "5"
        },
        {
          "type": "space",
          "spaceId": "6"
        },
        {
          "type": "space",
          "spaceId": "7"
        },
        {
          "type": "space",
          "spaceId": "9"
        },
        {
          "type": "space",
          "spaceId": "10"
        },
        {
          "type": "space",
          "spaceId": "11"
        },
        {
          "type": "space",
          "spaceId": "12"
        },
        {
          "type": "space",
          "spaceId": "13"
        },
        {
          "type": "space",
          "spaceId": "14"
        },
        {
          "type": "space",
          "spaceId": "14-1"
        },
        {
          "type": "space",
          "spaceId": "15"
        },
        {
          "type": "space",
          "spaceId": "16"
        },
        {
          "type": "space",
          "spaceId": "17"
        },
        {
          "type": "space",
          "spaceId": "18"
        },
        {
          "type": "space",
          "spaceId": "19"
        },
        {
          "type": "space",
          "spaceId": "20"
        },
        {
          "type": "space",
          "spaceId": "21"
        },
        {
          "type": "space",
          "spaceId": "22"
        },
        {
          "type": "space",
          "spaceId": "23"
        },
        {
          "type": "space",
          "spaceId": "24"
        },
        {
          "type": "space",
          "spaceId": "25"
        },
        {
          "type": "space",
          "spaceId": "26"
        },
        {
          "type": "space",
          "spaceId": "27"
        },
        {
          "type": "space",
          "spaceId": "28"
        },
        {
          "type": "space",
          "spaceId": "29"
        },
        {
          "type": "space",
          "spaceId": "30"
        },
        {
          "type": "space",
          "spaceId": "31"
        },
        {
          "type": "space",
          "spaceId": "32"
        },
        {
          "type": "space",
          "spaceId": "33"
        },
        {
          "type": "space",
          "spaceId": "34"
        },
        {
          "type": "space",
          "spaceId": "35"
        },
        {
          "type": "space",
          "spaceId": "36"
        },
        {
          "type": "space",
          "spaceId": "37"
        },
        {
          "type": "space",
          "spaceId": "38"
        },
        {
          "type": "space",
          "spaceId": "39"
        },
        {
          "type": "space",
          "spaceId": "40"
        },
        {
          "type": "space",
          "spaceId": "41"
        },
        {
          "type": "space",
          "spaceId": "42"
        },
        {
          "type": "space",
          "spaceId": "43"
        },
        {
          "type": "space",
          "spaceId": "44"
        },
        {
          "type": "space",
          "spaceId": "45"
        },
        {
          "type": "space",
          "spaceId": "46"
        },
        {
          "type": "space",
          "spaceId": "47"
        },
        {
          "type": "space",
          "spaceId": "48"
        },
        {
          "type": "space",
          "spaceId": "49"
        },
        {
          "type": "space",
          "spaceId": "50"
        },
        {
          "type": "space",
          "spaceId": "51"
        },
        {
          "type": "space",
          "spaceId": "52"
        },
        {
          "type": "space",
          "spaceId": "53"
        },
        {
          "type": "space",
          "spaceId": "54"
        },
        {
          "type": "space",
          "spaceId": "55"
        },
        {
          "type": "space",
          "spaceId": "56"
        },
        {
          "type": "space",
          "spaceId": "57"
        },
        {
          "type": "space",
          "spaceId": "58"
        },
        {
          "type": "space",
          "spaceId": "59"
        },
        {
          "type": "space",
          "spaceId": "60"
        },
        {
          "type": "space",
          "spaceId": "61"
        },
        {
          "type": "space",
          "spaceId": "62"
        },
        {
          "type": "space",
          "spaceId": "64"
        },
        {
          "type": "space",
          "spaceId": "65"
        },
        {
          "type": "space",
          "spaceId": "66"
        },
        {
          "type": "space",
          "spaceId": "67"
        },
        {
          "type": "space",
          "spaceId": "68"
        },
        {
          "type": "space",
          "spaceId": "69"
        },
        {
          "type": "space",
          "spaceId": "70"
        },
        {
          "type": "space",
          "spaceId": "71"
        },
        {
          "type": "space",
          "spaceId": "72"
        },
        {
          "type": "space",
          "spaceId": "73"
        },
        {
          "type": "space",
          "spaceId": "74"
        },
        {
          "type": "space",
          "spaceId": "75"
        },
        {
          "type": "space",
          "spaceId": "76"
        },
        {
          "type": "space",
          "spaceId": "77"
        },
        {
          "type": "space",